{
  "schema": "moparse-evidence/1",
  "id": "source-v6-130-independent-original-source-review-20261018",
  "method_id": "mineru-advanced-txt-vllm-c2-docling-source-glm-v6",
  "cohort_id": "regression-504",
  "origin": "fresh_component",
  "fresh_model_inference": false,
  "output_stage": "diagnostic-only",
  "quality": {},
  "performance": {},
  "provenance": [
    {
      "path": "benchmark/evidence/artifacts/33caa633277d555534ec9c0ceb0fed308a47c3f14827b9f453838e080d38b8b8.json",
      "sha256": "33caa633277d555534ec9c0ceb0fed308a47c3f14827b9f453838e080d38b8b8",
      "bytes": 2463,
      "original_path": "benchmark/runs/source-v6-http-20261018/130-independent-source-safe-summary.json",
      "snapshot_bytes_unchanged": true
    }
  ],
  "qualification": {
    "observation_only": true,
    "deployment_acceptance": false,
    "fixed_gold_and_scores_changed": false,
    "private_original_proofs_not_bundled": true,
    "both_seal_answers_source_inaccurate": true
  }
}
